[
  {
    "id": "card_ember_hollow",
    "title": "Salt Gate Permit Hall",
    "flavor": "Where Serin receives the sealed charter that can end or expand famine law.",
    "regionId": "gloamreach",
    "tags": [
      "arc1",
      "sanctum"
    ],
    "danger": 2,
    "rarity": "common",
    "entrySceneId": "ember_discovery_1",
    "postArcVariantId": "card_ember_hollow_resolved",
    "postArcStatus": "cleared",
    "postArcSceneId": "ember_aftermath"
  },
  {
    "id": "card_cinder_market",
    "title": "Debt Gate Market",
    "flavor": "Contract stalls where escort routes, toll marks, and witness favors are traded.",
    "regionId": "gloamreach",
    "tags": [
      "trade",
      "social"
    ],
    "danger": 1,
    "rarity": "common",
    "entrySceneId": "market_barter"
  },
  {
    "id": "card_root_archive",
    "title": "High Reader Archive",
    "flavor": "Living glass records preserving the amendments that shaped engineered scarcity.",
    "regionId": "gloamreach",
    "tags": [
      "knowledge"
    ],
    "danger": 2,
    "rarity": "uncommon",
    "entrySceneId": "archive_query"
  },
  {
    "id": "card_mire_bridge",
    "title": "Canal Midspan",
    "flavor": "Pressure bridge where relief convoys bottleneck under oath toll enforcement.",
    "regionId": "gloamreach",
    "tags": [
      "hazard"
    ],
    "danger": 3,
    "rarity": "uncommon",
    "entrySceneId": "mire_crossing"
  },
  {
    "id": "card_thorn_bastion",
    "title": "Synod Council Hall",
    "flavor": "Lantern Synod chamber where emergency doctrine is framed as lawful mercy.",
    "regionId": "gloamreach",
    "tags": [
      "arc1",
      "military"
    ],
    "danger": 3,
    "rarity": "rare",
    "entrySceneId": "ember_escalation_1",
    "requires": [
      {
        "type": "flag",
        "key": "arc_ember_discovered",
        "op": "==",
        "value": true
      }
    ]
  },
  {
    "id": "card_ashen_gate",
    "title": "Hollow Weirs Gate",
    "flavor": "Floodgate threshold hiding the charter engine that cycles scarcity by law.",
    "regionId": "gloamreach",
    "tags": [
      "arc1",
      "dungeon"
    ],
    "danger": 4,
    "rarity": "rare",
    "entrySceneId": "ember_dungeon_gate",
    "requires": [
      {
        "type": "flag",
        "key": "arc_ember_escalated",
        "op": "==",
        "value": true
      }
    ],
    "corruptionVariantAt": 35,
    "variantId": "card_ashen_gate_corrupted"
  },
  {
    "id": "card_prism_step",
    "title": "Mirror March Front",
    "flavor": "Receipt riots spread across glass canals as factions race to seize gate control.",
    "regionId": "glasswaste",
    "tags": [
      "arc2",
      "expanse"
    ],
    "danger": 2,
    "rarity": "common",
    "entrySceneId": "astral_discovery_1",
    "postArcVariantId": "card_prism_step_resolved",
    "postArcStatus": "cleared",
    "postArcSceneId": "astral_aftermath"
  },
  {
    "id": "card_sunken_orrery",
    "title": "Open Cistern Records",
    "flavor": "Submerged ledger vault mapping who profited from each ration doctrine cycle.",
    "regionId": "glasswaste",
    "tags": [
      "arc2",
      "ruins"
    ],
    "danger": 3,
    "rarity": "uncommon",
    "entrySceneId": "astral_escalation_1"
  },
  {
    "id": "card_mirror_lake",
    "title": "Witness Basin",
    "flavor": "A reflective channel where memory collateral and testimony become bargaining chips.",
    "regionId": "glasswaste",
    "tags": [
      "vision"
    ],
    "danger": 2,
    "rarity": "uncommon",
    "entrySceneId": "mirror_reflection"
  },
  {
    "id": "card_shard_forge",
    "title": "Floodline Forge",
    "flavor": "Emergency works that print seals, tools, and field locks for coalition crews.",
    "regionId": "glasswaste",
    "tags": [
      "craft"
    ],
    "danger": 2,
    "rarity": "common",
    "entrySceneId": "forge_tithe"
  },
  {
    "id": "card_starwell_rim",
    "title": "Charter Engine Core",
    "flavor": "The regent seat and lock lattice where basin authority can be severed or seized.",
    "regionId": "glasswaste",
    "tags": [
      "arc2",
      "dungeon"
    ],
    "danger": 4,
    "rarity": "rare",
    "entrySceneId": "astral_dungeon_gate",
    "requires": [
      {
        "type": "flag",
        "key": "arc_astral_escalated",
        "op": "==",
        "value": true
      }
    ],
    "corruptionVariantAt": 45,
    "variantId": "card_starwell_rim_corrupted"
  },
  {
    "id": "card_eclipse_court",
    "title": "Glass Court",
    "flavor": "Masked brokers arbitrate memory, passage, and monopoly in the crisis corridor.",
    "regionId": "glasswaste",
    "tags": [
      "arc2",
      "faction"
    ],
    "danger": 3,
    "rarity": "rare",
    "entrySceneId": "astral_escalation_2",
    "requires": [
      {
        "type": "flag",
        "key": "arc_astral_discovered",
        "op": "==",
        "value": true
      }
    ]
  }
]
